term	definition
two-man stand	An outdated climbing technique in which one climber stands on the shoulders of another climber as an assist in climbing.
udge	A technique needed to make slow upwards progress on holdless rock, especially off-width cracks.[45]
undercling	A hold which is gripped with the palm of the hand facing upwards.[9][46][47]
"v"-grade	A technical grading system for bouldering problems, invented by John Sherman.
v-thread	A type of abseiling point used especially in winter and in ice climbing.
verglas	A thin coating of ice that forms over rocks when rainfall or melting snow freezes on rock. Hard to climb on as there is usually insufficient depth for crampons to have reliable penetration. See also clear ice and glaze ice.
wad	A good climber. The term may have originated in Sheffield.[citation needed][46]
wand	A bamboo stick with a small flag on top used to mark paths over glaciers and snow fields.
webbing	A hollow and flat nylon strip, mainly used to make slings.
webolette	A piece of webbing with eyes sewn into the ends which can be used in place of a cordelette.
weighting	Any time a rope sustains the weight of the climber, e.g. "weighting the rope". This can happen during a minor fall, a whipper (long fall), or simply by resting while hanging on the belay rope. See also hangdogging.
whipper	A lead fall from above and to the side of the last clip, whipping oneself downwards and in an arc. The term has come to denote any fall beyond the last placed or clipped piece of protection.
wires	See nuts.
wolf moon	To complete a lead climb during the nighttime.
woodie	A homemade climbing wall. Often specifically a hybrid between a climbing wall and a fingerboard. Specifically called such because of the wooden panels (usually left unpainted) used to attach the climbing holds.
x (protection rating)	A rating from the Yosemite Decimal System given to climbs that have very poor or no protection. These climbs often present risk of serious injury or death if a fall were to occur, even if the climb is properly protected.
xeno	A hold appearing to be composed of a different type of rock than the surrounding rock face.
yabo	Another name for a sit start, named after John "Yabo" Yablonski.[48]
yard up	To pull on the rope to make upward progress, often with assistance from the belayer. This may be done to bypass a crux or to quickly regain ground lost after a fall without re-climbing the section.
yosemite decimal system	A numerical system for rating the difficulty of walks, hikes, and climbs, used primarily in the United States. The rock climbing (5.x) portion of the scale is the most common grading system used in the US. The scale starts with the easiest grades at 5.0 and is open-ended on the harder end. As of September 2017[update], the most difficult grade was 5.15d.
zawn	In the UK, a deep, narrow inlet in a sea cliff which is filled by the sea at high tide.
z-clipping	Clipping into a piece of protection with the segment of rope from beneath the previous piece of protection, resulting in a potentially dangerous tangled configuration of the belay rope. If not corrected, this can result in high drag.
zipper fall	A fall in which each piece of protection fails in turn. In some cases, when the rope comes taut during a fall, the protection can fail from the bottom up, especially if the first piece was not placed to account for outward and/or upward force.
z-pulley	A particular configuration of rope, anchors, and pulleys typically used to extricate a climber after falling into a crevasse.
